{"$schema":"https://json-schema.org/draft/2020-12/schema","title":"CapabilityDependencyGate","type":"object","additionalProperties":false,"required":["gate_id","version","status","proof_stages","builder_ready_policy","component_dependency_policy","addon_policy"],"properties":{"gate_id":{"type":"string"},"version":{"type":"string"},"status":{"type":"string"},"proof_stages":{"type":"array","minItems":9,"items":{"type":"object","required":["stage_id","purpose","accepted_evidence_tiers","not_proven_by","builder_ready_dependency"],"properties":{"stage_id":{"enum":["documented_capability","installed_version_supported","feature_enabled","core_or_pro","admin_permission_required","license_required","addon_required","third_party_dependency","project_availability_evidence_required"]},"purpose":{"type":"string"},"accepted_evidence_tiers":{"type":"array"},"not_proven_by":{"type":"array"},"builder_ready_dependency":{"type":"boolean"}}}},"builder_ready_policy":{"type":"object"},"component_dependency_policy":{"type":"object"},"addon_policy":{"type":"object"}}}
