{"gate_id":"capability-dependency-gate.v0","version":"0.1.0","status":"foundation","proof_stages":[{"stage_id":"documented_capability","purpose":"Official source documents the capability; this is not target availability.","accepted_evidence_tiers":["official_elementor_help","official_elementor_developer_docs"],"not_proven_by":["project_export_without_source_ref","community_tutorial"],"builder_ready_dependency":false},{"stage_id":"installed_version_supported","purpose":"Target installed version supports the capability.","accepted_evidence_tiers":["project_export","real_editor_capture","controlled_fixture","downstream_repo_evidence"],"not_proven_by":["official_elementor_help","official_elementor_developer_docs"],"builder_ready_dependency":true},{"stage_id":"feature_enabled","purpose":"Target project feature or experiment is enabled.","accepted_evidence_tiers":["project_export","real_editor_capture","controlled_fixture","downstream_repo_evidence"],"not_proven_by":["official_elementor_help","official_elementor_developer_docs"],"builder_ready_dependency":true},{"stage_id":"core_or_pro","purpose":"Capability is Core, Pro, or conditional; not target Pro availability.","accepted_evidence_tiers":["project_export","real_editor_capture","controlled_fixture","downstream_repo_evidence"],"not_proven_by":["official_elementor_help","official_elementor_developer_docs"],"builder_ready_dependency":false},{"stage_id":"admin_permission_required","purpose":"Admin or role permission may be required; not current user proof.","accepted_evidence_tiers":["project_export","real_editor_capture","controlled_fixture","downstream_repo_evidence"],"not_proven_by":["official_elementor_help","official_elementor_developer_docs"],"builder_ready_dependency":false},{"stage_id":"license_required","purpose":"License requirement boundary.","accepted_evidence_tiers":["project_export","real_editor_capture","controlled_fixture","downstream_repo_evidence"],"not_proven_by":["official_elementor_help","official_elementor_developer_docs"],"builder_ready_dependency":false},{"stage_id":"addon_required","purpose":"Addon requirement boundary.","accepted_evidence_tiers":["project_export","real_editor_capture","controlled_fixture","downstream_repo_evidence"],"not_proven_by":["official_elementor_help","official_elementor_developer_docs"],"builder_ready_dependency":false},{"stage_id":"third_party_dependency","purpose":"Non-native dependency boundary.","accepted_evidence_tiers":["project_export","real_editor_capture","controlled_fixture","downstream_repo_evidence"],"not_proven_by":["official_elementor_help","official_elementor_developer_docs"],"builder_ready_dependency":false},{"stage_id":"project_availability_evidence_required","purpose":"Target project evidence is required before Builder-ready or constructability claims.","accepted_evidence_tiers":["project_export","real_editor_capture","controlled_fixture","downstream_repo_evidence"],"not_proven_by":["official_elementor_help","official_elementor_developer_docs"],"builder_ready_dependency":true}],"builder_ready_policy":{"builder_ready_requires_capability_proof":true,"unproven_capability_status":"insufficient_evidence","blocked_when":["capability_proof_status_unproven","required_dependency_evidence_missing","feature_enabled_state_unknown","project_availability_evidence_missing"]},"component_dependency_policy":{"components_require_evidence_for":["core_or_pro","admin_permission_required","feature_enabled","project_availability_evidence_required"],"official_docs_do_not_prove_target_pro_or_admin":true},"addon_policy":{"third_party_dependency_must_not_be_native_v4":true,"addon_required_must_be_explicit":true}}
